"No.","Time","Source","Destination","Protocol","Length","Info"
"1","0.000000","192.168.5.143","66.42.104.150","TCP","54","56894  >  443 [ACK] Seq=1 Ack=1 Win=2048 Len=0"
"2","0.185800","66.42.104.150","192.168.5.143","TCP","66","[TCP ACKed unseen segment] 443  >  56894 [ACK] Seq=1 Ack=2 Win=48 Len=0 TSval=3180032660 TSecr=2616424020"
"3","0.281908","192.168.5.57","192.168.7.255","MDNS","1365","Standard query response 0x0000 PTR, cache flush MiTV4-ANSM0-5ea2d814c7edaa25.local TXT, cache flush PTR _raop._tcp.local PTR 5e572dad810b@\345\256\242\345\216\205\347\232\204\345\260\217\347\261\263\347\224\265\350\247†._raop._tcp.local TXT, cache flush PTR _airplay._tcp.local PTR \345\256\242\345\216\205\347\232\204\345\260\217\347\261\263\347\224\265\350\247†._airplay._tcp.local TXT, cache flush PTR _leboremote._tcp.local PTR \345\256\242\345\216\205\347\232\204\345\260\217\347\261\263\347\224\265\350\247†._leboremote._tcp.local A, cache flush 192.168.5.57 SRV, cache flush 0 0 52266 MiTV4-ANSM0-5ea2d814c7edaa25.local SRV, cache flush 0 0 52266 MiTV4-ANSM0-5ea2d814c7edaa25.local SRV, cache flush 0 0 52266 MiTV4-ANSM0-5ea2d814c7edaa25.local NSEC, cache flush 57.5.168.192.in-addr.arpa NSEC, cache flush 5e572dad810b@\345\256\242\345\216\205\347\232\204\345\260\217\347\261\263\347\224\265\350\247†._raop._tcp.local NSEC, cache flush \345\256\242\345\216\205\347\232\204\345\260\217\347\261\263\347\224\265\350\247†._airplay._tcp.local NSEC, cache flush \345\256\242\345\216\205\347\232\204\345\260\217\347\261\263\347\224\265\350\247†._leboremote._tcp.local NSEC, cache flush MiTV4-ANSM0-5ea2d814c7edaa25.local"
"4","0.283714","192.168.5.57","224.0.0.251","MDNS","1365","Standard query response 0x0000 PTR, cache flush MiTV4-ANSM0-5ea2d814c7edaa25.local TXT, cache flush PTR _raop._tcp.local PTR 5e572dad810b@\345\256\242\345\216\205\347\232\204\345\260\217\347\261\263\347\224\265\350\247†._raop._tcp.local TXT, cache flush PTR _airplay._tcp.local PTR \345\256\242\345\216\205\347\232\204\345\260\217\347\261\263\347\224\265\350\247†._airplay._tcp.local TXT, cache flush PTR _leboremote._tcp.local PTR \345\256\242\345\216\205\347\232\204\345\260\217\347\261\263\347\224\265\350\247†._leboremote._tcp.local A, cache flush 192.168.5.57 SRV, cache flush 0 0 52266 MiTV4-ANSM0-5ea2d814c7edaa25.local SRV, cache flush 0 0 52266 MiTV4-ANSM0-5ea2d814c7edaa25.local SRV, cache flush 0 0 52266 MiTV4-ANSM0-5ea2d814c7edaa25.local NSEC, cache flush 57.5.168.192.in-addr.arpa NSEC, cache flush 5e572dad810b@\345\256\242\345\216\205\347\232\204\345\260\217\347\261\263\347\224\265\350\247†._raop._tcp.local NSEC, cache flush \345\256\242\345\216\205\347\232\204\345\260\217\347\261\263\347\224\265\350\247†._airplay._tcp.local NSEC, cache flush \345\256\242\345\216\205\347\232\204\345\260\217\347\261\263\347\224\265\350\247†._leboremote._tcp.local NSEC, cache flush MiTV4-ANSM0-5ea2d814c7edaa25.local"
"5","0.553649","192.168.5.143","1.1.1.1","ICMP","58","Echo (ping) request  id=0xaa08, seq=0/0, ttl=64 (reply in 6)"
"6","0.650336","1.1.1.1","192.168.5.143","ICMP","58","Echo (ping) reply    id=0xaa08, seq=0/0, ttl=51 (request in 5)"
"7","1.217726","66.42.104.150","192.168.5.143","TCP","446","6300  >  54798 [PSH, ACK] Seq=1 Ack=1 Win=42 Len=380 TSval=3180033651 TSecr=1568260100"
"8","1.217728","66.42.104.150","192.168.5.143","TCP","599","6300  >  54798 [PSH, ACK] Seq=381 Ack=1 Win=42 Len=533 TSval=3180033664 TSecr=1568260100"
"9","1.217912","192.168.5.143","66.42.104.150","TCP","66","54798  >  6300 [ACK] Seq=1 Ack=914 Win=2048 Len=0 TSval=1568262149 TSecr=3180033664"
"10","1.294198","TpLinkTechno_f5:6b:28","Broadcast","ARP","60","Who has 192.168.5.156? Tell 192.168.6.1"
"11","1.294200","TpLinkTechno_f5:6b:28","Broadcast","ARP","60","Who has 192.168.5.76? Tell 192.168.6.1"
"12","1.552916","192.168.5.143","1.1.1.1","ICMP","58","Echo (ping) request  id=0xaa08, seq=0/0, ttl=64 (reply in 13)"
"13","1.648656","1.1.1.1","192.168.5.143","ICMP","58","Echo (ping) reply    id=0xaa08, seq=0/0, ttl=51 (request in 12)"
"14","2.324093","TpLinkTechno_f5:6b:28","Broadcast","ARP","60","Who has 192.168.5.156? Tell 192.168.6.1"
"15","2.552629","192.168.5.143","1.1.1.1","ICMP","58","Echo (ping) request  id=0xaa08, seq=0/0, ttl=64 (reply in 16)"
"16","2.649506","1.1.1.1","192.168.5.143","ICMP","58","Echo (ping) reply    id=0xaa08, seq=0/0, ttl=51 (request in 15)"
"17","2.716259","192.168.5.143","66.42.104.150","TLSv1.2","184","Application Data"
"18","2.917317","66.42.104.150","192.168.5.143","TCP","66","443  >  56007 [ACK] Seq=1 Ack=119 Win=43 Len=0 TSval=3180035398 TSecr=2919233604"
"19","3.032805","192.168.5.143","66.42.104.150","TCP","54","56260  >  443 [ACK] Seq=1 Ack=1 Win=2048 Len=0"
"20","3.101709","66.42.104.150","192.168.5.143","TLSv1.2","185","Application Data"
"21","3.101846","192.168.5.143","66.42.104.150","TCP","66","56007  >  443 [ACK] Seq=119 Ack=120 Win=2221 Len=0 TSval=2919233990 TSecr=3180035583"
"22","3.168140","66.42.104.150","192.168.5.143","TCP","446","6300  >  54798 [PSH, ACK] Seq=914 Ack=1 Win=42 Len=380 TSval=3180035651 TSecr=1568262149"
"23","3.168304","192.168.5.143","66.42.104.150","TCP","66","54798  >  6300 [ACK] Seq=1 Ack=1294 Win=2048 Len=0 TSval=1568264099 TSecr=3180035651"
"24","3.200084","66.42.104.150","192.168.5.143","TCP","66","[TCP ACKed unseen segment] 443  >  56260 [ACK] Seq=1 Ack=2 Win=42 Len=0 TSval=3180035685 TSecr=2902987141"
"25","3.553131","192.168.5.143","1.1.1.1","ICMP","58","Echo (ping) request  id=0xaa08, seq=0/0, ttl=64 (reply in 27)"
"26","3.637196","192.168.5.143","66.42.104.150","TCP","54","56647  >  443 [ACK] Seq=1 Ack=1 Win=2048 Len=0"
"27","3.650185","1.1.1.1","192.168.5.143","ICMP","58","Echo (ping) reply    id=0xaa08, seq=0/0, ttl=51 (request in 25)"
"28","3.807918","66.42.104.150","192.168.5.143","TCP","66","[TCP ACKed unseen segment] 443  >  56647 [ACK] Seq=1 Ack=2 Win=42 Len=0 TSval=3180036291 TSecr=553583331"
"29","4.274666","192.168.5.57","192.168.7.255","MDNS","1365","Standard query response 0x0000 PTR, cache flush MiTV4-ANSM0-5ea2d814c7edaa25.local TXT, cache flush PTR _raop._tcp.local PTR 5e572dad810b@\345\256\242\345\216\205\347\232\204\345\260\217\347\261\263\347\224\265\350\247†._raop._tcp.local TXT, cache flush PTR _airplay._tcp.local PTR \345\256\242\345\216\205\347\232\204\345\260\217\347\261\263\347\224\265\350\247†._airplay._tcp.local TXT, cache flush PTR _leboremote._tcp.local PTR \345\256\242\345\216\205\347\232\204\345\260\217\347\261\263\347\224\265\350\247†._leboremote._tcp.local A, cache flush 192.168.5.57 SRV, cache flush 0 0 52266 MiTV4-ANSM0-5ea2d814c7edaa25.local SRV, cache flush 0 0 52266 MiTV4-ANSM0-5ea2d814c7edaa25.local SRV, cache flush 0 0 52266 MiTV4-ANSM0-5ea2d814c7edaa25.local NSEC, cache flush 57.5.168.192.in-addr.arpa NSEC, cache flush 5e572dad810b@\345\256\242\345\216\205\347\232\204\345\260\217\347\261\263\347\224\265\350\247†._raop._tcp.local NSEC, cache flush \345\256\242\345\216\205\347\232\204\345\260\217\347\261\263\347\224\265\350\247†._airplay._tcp.local NSEC, cache flush \345\256\242\345\216\205\347\232\204\345\260\217\347\261\263\347\224\265\350\247†._leboremote._tcp.local NSEC, cache flush MiTV4-ANSM0-5ea2d814c7edaa25.local"
"30","4.275755","192.168.5.57","224.0.0.251","MDNS","1365","Standard query response 0x0000 PTR, cache flush MiTV4-ANSM0-5ea2d814c7edaa25.local TXT, cache flush PTR _raop._tcp.local PTR 5e572dad810b@\345\256\242\345\216\205\347\232\204\345\260\217\347\261\263\347\224\265\350\247†._raop._tcp.local TXT, cache flush PTR _airplay._tcp.local PTR \345\256\242\345\216\205\347\232\204\345\260\217\347\261\263\347\224\265\350\247†._airplay._tcp.local TXT, cache flush PTR _leboremote._tcp.local PTR \345\256\242\345\216\205\347\232\204\345\260\217\347\261\263\347\224\265\350\247†._leboremote._tcp.local A, cache flush 192.168.5.57 SRV, cache flush 0 0 52266 MiTV4-ANSM0-5ea2d814c7edaa25.local SRV, cache flush 0 0 52266 MiTV4-ANSM0-5ea2d814c7edaa25.local SRV, cache flush 0 0 52266 MiTV4-ANSM0-5ea2d814c7edaa25.local NSEC, cache flush 57.5.168.192.in-addr.arpa NSEC, cache flush 5e572dad810b@\345\256\242\345\216\205\347\232\204\345\260\217\347\261\263\347\224\265\350\247†._raop._tcp.local NSEC, cache flush \345\256\242\345\216\205\347\232\204\345\260\217\347\261\263\347\224\265\350\247†._airplay._tcp.local NSEC, cache flush \345\256\242\345\216\205\347\232\204\345\260\217\347\261\263\347\224\265\350\247†._leboremote._tcp.local NSEC, cache flush MiTV4-ANSM0-5ea2d814c7edaa25.local"
"31","4.388840","192.168.5.143","66.42.104.150","TCP","54","54880  >  443 [ACK] Seq=1 Ack=1 Win=2048 Len=0"
"32","4.552825","192.168.5.143","1.1.1.1","ICMP","58","Echo (ping) request  id=0xaa08, seq=0/0, ttl=64 (reply in 34)"
"33","4.579613","66.42.104.150","192.168.5.143","TCP","66","[TCP ACKed unseen segment] 443  >  54880 [ACK] Seq=1 Ack=2 Win=59 Len=0 TSval=3180037051 TSecr=1384329756"
"34","4.640148","1.1.1.1","192.168.5.143","ICMP","58","Echo (ping) reply    id=0xaa08, seq=0/0, ttl=51 (request in 32)"
"35","4.790676","192.168.5.143","66.42.104.150","TCP","54","56254  >  443 [ACK] Seq=1 Ack=1 Win=2048 Len=0"
"36","4.960071","66.42.104.150","192.168.5.143","TCP","66","[TCP ACKed unseen segment] 443  >  56254 [ACK] Seq=1 Ack=2 Win=42 Len=0 TSval=3180037441 TSecr=2423376286"
"37","4.981197","MicroStarINT_f3:89:08","Broadcast","ARP","60","Who has 169.254.169.254? Tell 192.168.5.17"
"38","4.992330","192.168.5.143","66.42.104.150","TCP","54","56259  >  443 [ACK] Seq=1 Ack=1 Win=2048 Len=0"
"39","5.179781","66.42.104.150","192.168.5.143","TCP","444","6300  >  54798 [PSH, ACK] Seq=1294 Ack=1 Win=42 Len=378 TSval=3180037651 TSecr=1568264099"
"40","5.179782","66.42.104.150","192.168.5.143","TCP","66","[TCP ACKed unseen segment] 443  >  56259 [ACK] Seq=1 Ack=2 Win=40 Len=0 TSval=3180037647 TSecr=2137738471"
"41","5.179891","192.168.5.143","66.42.104.150","TCP","66","54798  >  6300 [ACK] Seq=1 Ack=1672 Win=2048 Len=0 TSval=1568266111 TSecr=3180037651"
"42","5.499803","TpLinkTechno_f5:6b:28","ae:c9:be:7d:9f:58","ARP","42","Who has 192.168.5.143? Tell 192.168.6.1"
"43","5.499891","ae:c9:be:7d:9f:58","TpLinkTechno_f5:6b:28","ARP","42","192.168.5.143 is at ae:c9:be:7d:9f:58"
"44","5.553031","192.168.5.143","1.1.1.1","ICMP","58","Echo (ping) request  id=0xaa08, seq=0/0, ttl=64 (reply in 45)"
"45","5.650058","1.1.1.1","192.168.5.143","ICMP","58","Echo (ping) reply    id=0xaa08, seq=0/0, ttl=51 (request in 44)"
"46","5.805990","MicroStarINT_f3:89:08","Broadcast","ARP","60","Who has 169.254.169.254? Tell 192.168.5.17"
"47","6.227268","66.42.104.150","192.168.5.143","TCP","312","6300  >  54798 [PSH, ACK] Seq=1672 Ack=1 Win=42 Len=246 TSval=3180038655 TSecr=1568266111"
"48","6.227269","66.42.104.150","192.168.5.143","TCP","352","6300  >  54798 [PSH, ACK] Seq=1918 Ack=1 Win=42 Len=286 TSval=3180038663 TSecr=1568266111"
"49","6.227457","192.168.5.143","66.42.104.150","TCP","66","54798  >  6300 [ACK] Seq=1 Ack=2204 Win=2048 Len=0 TSval=1568267159 TSecr=3180038663"
"50","6.553308","192.168.5.143","1.1.1.1","ICMP","58","Echo (ping) request  id=0xaa08, seq=0/0, ttl=64 (reply in 51)"
"51","6.646082","1.1.1.1","192.168.5.143","ICMP","58","Echo (ping) reply    id=0xaa08, seq=0/0, ttl=51 (request in 50)"
"52","6.820677","66.42.104.150","192.168.5.143","TCP","66","6300  >  54797 [ACK] Seq=1 Ack=1 Win=54 Len=0 TSval=3180039297 TSecr=3991516163"
"53","6.820813","192.168.5.143","66.42.104.150","TCP","66","[TCP ACKed unseen segment] 54797  >  6300 [ACK] Seq=1 Ack=2 Win=2048 Len=0 TSval=3991531516 TSecr=3177888689"
"54","6.836082","MicroStarINT_f3:89:08","Broadcast","ARP","60","Who has 169.254.169.254? Tell 192.168.5.17"
"55","6.896382","192.168.5.143","66.42.104.150","TCP","54","56685  >  443 [ACK] Seq=1 Ack=1 Win=2048 Len=0"
"56","7.074884","66.42.104.150","192.168.5.143","TCP","66","[TCP ACKed unseen segment] 443  >  56685 [ACK] Seq=1 Ack=2 Win=43 Len=0 TSval=3180039551 TSecr=3532124704"
"57","7.183804","66.42.104.150","192.168.5.143","TCP","442","6300  >  54798 [PSH, ACK] Seq=2204 Ack=1 Win=42 Len=376 TSval=3180039651 TSecr=1568267159"
"58","7.183939","192.168.5.143","66.42.104.150","TCP","66","54798  >  6300 [ACK] Seq=1 Ack=2580 Win=2048 Len=0 TSval=1568268115 TSecr=3180039651"
"59","7.551808","192.168.5.143","1.1.1.1","ICMP","58","Echo (ping) request  id=0xaa08, seq=0/0, ttl=64 (reply in 60)"
"60","7.645622","1.1.1.1","192.168.5.143","ICMP","58","Echo (ping) reply    id=0xaa08, seq=0/0, ttl=51 (request in 59)"
"61","8.090283","192.168.5.143","66.42.104.150","TCP","54","56044  >  443 [ACK] Seq=1 Ack=1 Win=2048 Len=0"
"62","8.271666","192.168.5.57","192.168.7.255","MDNS","1365","Standard query response 0x0000 PTR, cache flush MiTV4-ANSM0-5ea2d814c7edaa25.local TXT, cache flush PTR _raop._tcp.local PTR 5e572dad810b@\345\256\242\345\216\205\347\232\204\345\260\217\347\261\263\347\224\265\350\247†._raop._tcp.local TXT, cache flush PTR _airplay._tcp.local PTR \345\256\242\345\216\205\347\232\204\345\260\217\347\261\263\347\224\265\350\247†._airplay._tcp.local TXT, cache flush PTR _leboremote._tcp.local PTR \345\256\242\345\216\205\347\232\204\345\260\217\347\261\263\347\224\265\350\247†._leboremote._tcp.local A, cache flush 192.168.5.57 SRV, cache flush 0 0 52266 MiTV4-ANSM0-5ea2d814c7edaa25.local SRV, cache flush 0 0 52266 MiTV4-ANSM0-5ea2d814c7edaa25.local SRV, cache flush 0 0 52266 MiTV4-ANSM0-5ea2d814c7edaa25.local NSEC, cache flush 57.5.168.192.in-addr.arpa NSEC, cache flush 5e572dad810b@\345\256\242\345\216\205\347\232\204\345\260\217\347\261\263\347\224\265\350\247†._raop._tcp.local NSEC, cache flush \345\256\242\345\216\205\347\232\204\345\260\217\347\261\263\347\224\265\350\247†._airplay._tcp.local NSEC, cache flush \345\256\242\345\216\205\347\232\204\345\260\217\347\261\263\347\224\265\350\247†._leboremote._tcp.local NSEC, cache flush MiTV4-ANSM0-5ea2d814c7edaa25.local"
"63","8.273658","192.168.5.57","224.0.0.251","MDNS","1365","Standard query response 0x0000 PTR, cache flush MiTV4-ANSM0-5ea2d814c7edaa25.local TXT, cache flush PTR _raop._tcp.local PTR 5e572dad810b@\345\256\242\345\216\205\347\232\204\345\260\217\347\261\263\347\224\265\350\247†._raop._tcp.local TXT, cache flush PTR _airplay._tcp.local PTR \345\256\242\345\216\205\347\232\204\345\260\217\347\261\263\347\224\265\350\247†._airplay._tcp.local TXT, cache flush PTR _leboremote._tcp.local PTR \345\256\242\345\216\205\347\232\204\345\260\217\347\261\263\347\224\265\350\247†._leboremote._tcp.local A, cache flush 192.168.5.57 SRV, cache flush 0 0 52266 MiTV4-ANSM0-5ea2d814c7edaa25.local SRV, cache flush 0 0 52266 MiTV4-ANSM0-5ea2d814c7edaa25.local SRV, cache flush 0 0 52266 MiTV4-ANSM0-5ea2d814c7edaa25.local NSEC, cache flush 57.5.168.192.in-addr.arpa NSEC, cache flush 5e572dad810b@\345\256\242\345\216\205\347\232\204\345\260\217\347\261\263\347\224\265\350\247†._raop._tcp.local NSEC, cache flush \345\256\242\345\216\205\347\232\204\345\260\217\347\261\263\347\224\265\350\247†._airplay._tcp.local NSEC, cache flush \345\256\242\345\216\205\347\232\204\345\260\217\347\261\263\347\224\265\350\247†._leboremote._tcp.local NSEC, cache flush MiTV4-ANSM0-5ea2d814c7edaa25.local"
"64","8.273660","TpLinkTechno_f5:6b:28","Broadcast","ARP","60","Who has 192.168.5.36? Tell 192.168.6.1"
"65","8.279090","66.42.104.150","192.168.5.143","TCP","66","[TCP ACKed unseen segment] 443  >  56044 [ACK] Seq=1 Ack=2 Win=39 Len=0 TSval=3180040750 TSecr=3435001363"
"66","8.363643","TpLinkTechno_f5:6b:28","Broadcast","ARP","60","Who has 192.168.5.24? Tell 192.168.6.1"
"67","8.552799","192.168.5.143","1.1.1.1","ICMP","58","Echo (ping) request  id=0xaa08, seq=0/0, ttl=64 (reply in 69)"
"68","8.580554","HikvisionDig_cb:90:f5","Broadcast","ARP","60","Who has 192.168.5.22? (ARP Probe)"
"69","8.653048","1.1.1.1","192.168.5.143","ICMP","58","Echo (ping) reply    id=0xaa08, seq=0/0, ttl=51 (request in 67)"
"70","9.094966","192.168.5.143","66.42.104.150","TCP","54","56810  >  443 [ACK] Seq=1 Ack=1 Win=2048 Len=0"
"71","9.168961","66.42.104.150","192.168.5.143","TCP","443","6300  >  54798 [PSH, ACK] Seq=2580 Ack=1 Win=42 Len=377 TSval=3180041651 TSecr=1568268115"
"72","9.169141","192.168.5.143","66.42.104.150","TCP","66","54798  >  6300 [ACK] Seq=1 Ack=2957 Win=2048 Len=0 TSval=1568270100 TSecr=3180041651"
"73","9.293632","66.42.104.150","192.168.5.143","TCP","66","[TCP ACKed unseen segment] 443  >  56810 [ACK] Seq=1 Ack=2 Win=42 Len=0 TSval=3180041753 TSecr=1884609761"
"74","9.552935","192.168.5.143","1.1.1.1","ICMP","58","Echo (ping) request  id=0xaa08, seq=0/0, ttl=64 (reply in 75)"
"75","9.653172","1.1.1.1","192.168.5.143","ICMP","58","Echo (ping) reply    id=0xaa08, seq=0/0, ttl=51 (request in 74)"
"76","10.208660","192.168.5.57","224.0.0.251","MDNS","91","Standard query response 0x0000 A, cache flush 192.168.5.57"
"77","10.551661","192.168.5.143","1.1.1.1","ICMP","58","Echo (ping) request  id=0xaa08, seq=0/0, ttl=64 (reply in 78)"
"78","10.650178","1.1.1.1","192.168.5.143","ICMP","58","Echo (ping) reply    id=0xaa08, seq=0/0, ttl=51 (request in 77)"
"79","10.718511","HikvisionDig_cb:90:f5","Broadcast","ARP","60","Who has 192.168.6.1? Tell 192.168.5.22"
"80","10.790636","192.168.5.143","66.42.104.150","TCP","54","56831  >  443 [ACK] Seq=1 Ack=1 Win=2048 Len=0"
"81","10.890858","192.168.5.143","66.42.104.150","TCP","54","56834  >  443 [ACK] Seq=1 Ack=1 Win=2048 Len=0"
"82","10.980654","66.42.104.150","192.168.5.143","TCP","66","[TCP ACKed unseen segment] 443  >  56831 [ACK] Seq=1 Ack=2 Win=39 Len=0 TSval=3180043446 TSecr=2636153335"
"83","10.991896","192.168.5.143","66.42.104.150","TCP","54","56832  >  443 [ACK] Seq=1 Ack=1 Win=2048 Len=0"
"84","11.079166","66.42.104.150","192.168.5.143","TCP","66","[TCP ACKed unseen segment] 443  >  56834 [ACK] Seq=1 Ack=2 Win=42 Len=0 TSval=3180043546 TSecr=3361780668"
"85","11.169169","66.42.104.150","192.168.5.143","TCP","66","[TCP ACKed unseen segment] 443  >  56832 [ACK] Seq=1 Ack=2 Win=39 Len=0 TSval=3180043643 TSecr=2771309705"
"86","11.169171","66.42.104.150","192.168.5.143","TCP","447","6300  >  54798 [PSH, ACK] Seq=2957 Ack=1 Win=42 Len=381 TSval=3180043651 TSecr=1568270100"
"87","11.169380","192.168.5.143","66.42.104.150","TCP","66","54798  >  6300 [ACK] Seq=1 Ack=3338 Win=2048 Len=0 TSval=1568272101 TSecr=3180043651"
"88","11.181585","66.42.104.150","192.168.5.143","TCP","493","6300  >  54798 [PSH, ACK] Seq=3338 Ack=1 Win=42 Len=427 TSval=3180043664 TSecr=1568270100"
"89","11.181757","192.168.5.143","66.42.104.150","TCP","66","54798  >  6300 [ACK] Seq=1 Ack=3765 Win=2048 Len=0 TSval=1568272113 TSecr=3180043664"
"90","11.292822","192.168.5.143","66.42.104.150","TCP","54","56842  >  443 [ACK] Seq=1 Ack=1 Win=2048 Len=0"
"91","11.393453","192.168.5.143","66.42.104.150","TCP","54","56835  >  443 [ACK] Seq=1 Ack=1 Win=2048 Len=0"
"92","11.430651","66.42.104.150","192.168.5.143","TCP","66","6300  >  54796 [ACK] Seq=1 Ack=1 Win=39 Len=0 TSval=3180043905 TSecr=1935780063"
"93","11.430826","192.168.5.143","66.42.104.150","TCP","66","[TCP ACKed unseen segment] 54796  >  6300 [ACK] Seq=1 Ack=2 Win=2048 Len=0 TSval=1935795419 TSecr=3177740205"
"94","11.435870","66.42.104.150","192.168.5.143","TCP","66","6300  >  54795 [ACK] Seq=1 Ack=1 Win=44 Len=0 TSval=3180043905 TSecr=313696901"
"95","11.436044","192.168.5.143","66.42.104.150","TCP","66","[TCP ACKed unseen segment] 54795  >  6300 [ACK] Seq=1 Ack=2 Win=2938 Len=0 TSval=313712263 TSecr=3177740030"
"96","11.466702","66.42.104.150","192.168.5.143","TCP","66","[TCP ACKed unseen segment] 443  >  56842 [ACK] Seq=1 Ack=2 Win=40 Len=0 TSval=3180043948 TSecr=2949538622"
"97","11.552498","192.168.5.143","1.1.1.1","ICMP","58","Echo (ping) request  id=0xaa08, seq=0/0, ttl=64 (reply in 99)"
"98","11.584421","66.42.104.150","192.168.5.143","TCP","66","[TCP ACKed unseen segment] 443  >  56835 [ACK] Seq=1 Ack=2 Win=39 Len=0 TSval=3180044051 TSecr=3832983861"
"99","11.645823","1.1.1.1","192.168.5.143","ICMP","58","Echo (ping) reply    id=0xaa08, seq=0/0, ttl=51 (request in 97)"
"100","11.893663","192.168.5.143","66.42.104.150","TCP","54","56844  >  443 [ACK] Seq=1 Ack=1 Win=2048 Len=0"
"101","11.893789","192.168.5.143","66.42.104.150","TCP","54","56840  >  443 [ACK] Seq=1 Ack=1 Win=2048 Len=0"
"102","11.893793","192.168.5.143","66.42.104.150","TCP","54","56829  >  443 [ACK] Seq=1 Ack=1 Win=2048 Len=0"
"103","12.085306","66.42.104.150","192.168.5.143","TCP","54","443  >  56844 [RST] Seq=1 Win=0 Len=0"
"104","12.120565","66.42.104.150","192.168.5.143","TCP","54","443  >  56840 [RST] Seq=1 Win=0 Len=0"
"105","12.260616","192.168.5.57","192.168.7.255","MDNS","1365","Standard query response 0x0000 PTR, cache flush MiTV4-ANSM0-5ea2d814c7edaa25.local TXT, cache flush PTR _raop._tcp.local PTR 5e572dad810b@\345\256\242\345\216\205\347\232\204\345\260\217\347\261\263\347\224\265\350\247†._raop._tcp.local TXT, cache flush PTR _airplay._tcp.local PTR \345\256\242\345\216\205\347\232\204\345\260\217\347\261\263\347\224\265\350\247†._airplay._tcp.local TXT, cache flush PTR _leboremote._tcp.local PTR \345\256\242\345\216\205\347\232\204\345\260\217\347\261\263\347\224\265\350\247†._leboremote._tcp.local A, cache flush 192.168.5.57 SRV, cache flush 0 0 52266 MiTV4-ANSM0-5ea2d814c7edaa25.local SRV, cache flush 0 0 52266 MiTV4-ANSM0-5ea2d814c7edaa25.local SRV, cache flush 0 0 52266 MiTV4-ANSM0-5ea2d814c7edaa25.local NSEC, cache flush 57.5.168.192.in-addr.arpa NSEC, cache flush 5e572dad810b@\345\256\242\345\216\205\347\232\204\345\260\217\347\261\263\347\224\265\350\247†._raop._tcp.local NSEC, cache flush \345\256\242\345\216\205\347\232\204\345\260\217\347\261\263\347\224\265\350\247†._airplay._tcp.local NSEC, cache flush \345\256\242\345\216\205\347\232\204\345\260\217\347\261\263\347\224\265\350\247†._leboremote._tcp.local NSEC, cache flush MiTV4-ANSM0-5ea2d814c7edaa25.local"
"106","12.262511","192.168.5.57","224.0.0.251","MDNS","1365","Standard query response 0x0000 PTR, cache flush MiTV4-ANSM0-5ea2d814c7edaa25.local TXT, cache flush PTR _raop._tcp.local PTR 5e572dad810b@\345\256\242\345\216\205\347\232\204\345\260\217\347\261\263\347\224\265\350\247†._raop._tcp.local TXT, cache flush PTR _airplay._tcp.local PTR \345\256\242\345\216\205\347\232\204\345\260\217\347\261\263\347\224\265\350\247†._airplay._tcp.local TXT, cache flush PTR _leboremote._tcp.local PTR \345\256\242\345\216\205\347\232\204\345\260\217\347\261\263\347\224\265\350\247†._leboremote._tcp.local A, cache flush 192.168.5.57 SRV, cache flush 0 0 52266 MiTV4-ANSM0-5ea2d814c7edaa25.local SRV, cache flush 0 0 52266 MiTV4-ANSM0-5ea2d814c7edaa25.local SRV, cache flush 0 0 52266 MiTV4-ANSM0-5ea2d814c7edaa25.local NSEC, cache flush 57.5.168.192.in-addr.arpa NSEC, cache flush 5e572dad810b@\345\256\242\345\216\205\347\232\204\345\260\217\347\261\263\347\224\265\350\247†._raop._tcp.local NSEC, cache flush \345\256\242\345\216\205\347\232\204\345\260\217\347\261\263\347\224\265\350\247†._airplay._tcp.local NSEC, cache flush \345\256\242\345\216\205\347\232\204\345\260\217\347\261\263\347\224\265\350\247†._leboremote._tcp.local NSEC, cache flush MiTV4-ANSM0-5ea2d814c7edaa25.local"
"107","12.394839","192.168.5.143","66.42.104.150","TCP","54","56872  >  443 [ACK] Seq=1 Ack=1 Win=2048 Len=0"
"108","12.552560","192.168.5.143","1.1.1.1","ICMP","58","Echo (ping) request  id=0xaa08, seq=0/0, ttl=64 (reply in 110)"
"109","12.575182","66.42.104.150","192.168.5.143","TCP","54","443  >  56872 [RST] Seq=1 Win=0 Len=0"
"110","12.638963","1.1.1.1","192.168.5.143","ICMP","58","Echo (ping) reply    id=0xaa08, seq=0/0, ttl=51 (request in 108)"
"111","12.715740","192.168.5.143","66.42.104.150","TLSv1.2","184","Application Data"
"112","12.726585","192.168.5.143","66.42.104.150","TCP","54","56364  >  443 [ACK] Seq=1 Ack=1 Win=2048 Len=0"
"113","12.916517","66.42.104.150","192.168.5.143","TCP","66","[TCP ACKed unseen segment] 443  >  56364 [ACK] Seq=1 Ack=2 Win=42 Len=0 TSval=3180045381 TSecr=4185140330"
"114","12.916519","66.42.104.150","192.168.5.143","TCP","66","443  >  56007 [ACK] Seq=120 Ack=237 Win=43 Len=0 TSval=3180045397 TSecr=2919243604"
"115","12.921743","192.168.5.143","66.42.104.150","TCP","54","56244  >  443 [ACK] Seq=1 Ack=1 Win=2048 Len=0"
"116","12.972668","192.168.5.57","224.0.0.251","MDNS","445","Standard query response 0x0000 PTR \345\256\242\345\216\205\347\232\204\345\260\217\347\261\263\347\224\265\350\247†._rc._tcp.local SRV, cache flush 0 0 6091 milink521230473.local TXT, cache flush"
"117","13.088145","66.42.104.150","192.168.5.143","TLSv1.2","185","Application Data"
"118","13.088269","192.168.5.143","66.42.104.150","TCP","66","56007  >  443 [ACK] Seq=237 Ack=239 Win=2221 Len=0 TSval=2919243977 TSecr=3180045570"
"119","13.090175","66.42.104.150","192.168.5.143","TCP","66","[TCP ACKed unseen segment] 443  >  56244 [ACK] Seq=1 Ack=2 Win=45 Len=0 TSval=3180045576 TSecr=158208247"
"120","13.166527","66.42.104.150","192.168.5.143","TCP","444","6300  >  54798 [PSH, ACK] Seq=3765 Ack=1 Win=42 Len=378 TSval=3180045652 TSecr=1568272113"
"121","13.166662","192.168.5.143","66.42.104.150","TCP","66","54798  >  6300 [ACK] Seq=1 Ack=4143 Win=2048 Len=0 TSval=1568274098 TSecr=3180045652"
"122","13.275010","192.168.5.143","66.42.104.150","TLSv1.2","325","Application Data"
"123","13.466093","66.42.104.150","192.168.5.143","TCP","1454","443  >  54905 [ACK] Seq=1 Ack=260 Win=39 Len=1388 TSval=3180045936 TSecr=1755910227 [TCP PDU reassembled in 144]"
"124","13.466218","192.168.5.143","66.42.104.150","TCP","66","54905  >  443 [ACK] Seq=260 Ack=1389 Win=2570 Len=0 TSval=1755910418 TSecr=3180045936"
"125","13.487117","66.42.104.150","192.168.5.143","TCP","1454","443  >  54905 [ACK] Seq=1389 Ack=260 Win=39 Len=1388 TSval=3180045949 TSecr=1755910227 [TCP PDU reassembled in 144]"
"126","13.487244","192.168.5.143","66.42.104.150","TCP","66","54905  >  443 [ACK] Seq=260 Ack=2777 Win=2569 Len=0 TSval=1755910439 TSecr=3180045949"
"127","13.501427","66.42.104.150","192.168.5.143","TCP","1454","443  >  54905 [ACK] Seq=2777 Ack=260 Win=39 Len=1388 TSval=3180045974 TSecr=1755910227 [TCP PDU reassembled in 144]"
"128","13.501549","192.168.5.143","66.42.104.150","TCP","66","54905  >  443 [ACK] Seq=260 Ack=4165 Win=2569 Len=0 TSval=1755910453 TSecr=3180045974"
"129","13.527313","192.168.5.143","66.42.104.150","TCP","54","56230  >  443 [ACK] Seq=1 Ack=1 Win=2048 Len=0"
"130","13.527823","66.42.104.150","192.168.5.143","TCP","1454","443  >  54905 [ACK] Seq=4165 Ack=260 Win=39 Len=1388 TSval=3180045999 TSecr=1755910227 [TCP PDU reassembled in 144]"
"131","13.527924","192.168.5.143","66.42.104.150","TCP","66","54905  >  443 [ACK] Seq=260 Ack=5553 Win=2569 Len=0 TSval=1755910479 TSecr=3180045999"
"132","13.551976","192.168.5.143","1.1.1.1","ICMP","58","Echo (ping) request  id=0xaa08, seq=0/0, ttl=64 (reply in 141)"
"133","13.556863","66.42.104.150","192.168.5.143","TCP","1454","443  >  54905 [ACK] Seq=5553 Ack=260 Win=39 Len=1388 TSval=3180046024 TSecr=1755910227 [TCP PDU reassembled in 144]"
"134","13.556934","192.168.5.143","66.42.104.150","TCP","66","54905  >  443 [ACK] Seq=260 Ack=6941 Win=2569 Len=0 TSval=1755910509 TSecr=3180046024"
"135","13.578810","66.42.104.150","192.168.5.143","TCP","1454","443  >  54905 [ACK] Seq=6941 Ack=260 Win=39 Len=1388 TSval=3180046049 TSecr=1755910227 [TCP PDU reassembled in 144]"
"136","13.578927","192.168.5.143","66.42.104.150","TCP","66","54905  >  443 [ACK] Seq=260 Ack=8329 Win=2569 Len=0 TSval=1755910531 TSecr=3180046049"
"137","13.598861","66.42.104.150","192.168.5.143","TCP","1454","443  >  54905 [ACK] Seq=8329 Ack=260 Win=39 Len=1388 TSval=3180046074 TSecr=1755910227 [TCP PDU reassembled in 144]"
"138","13.598975","192.168.5.143","66.42.104.150","TCP","66","54905  >  443 [ACK] Seq=260 Ack=9717 Win=2569 Len=0 TSval=1755910551 TSecr=3180046074"
"139","13.626678","66.42.104.150","192.168.5.143","TCP","1454","443  >  54905 [ACK] Seq=9717 Ack=260 Win=39 Len=1388 TSval=3180046099 TSecr=1755910227 [TCP PDU reassembled in 144]"
"140","13.626758","192.168.5.143","66.42.104.150","TCP","66","54905  >  443 [ACK] Seq=260 Ack=11105 Win=2569 Len=0 TSval=1755910578 TSecr=3180046099"
"141","13.644771","1.1.1.1","192.168.5.143","ICMP","58","Echo (ping) reply    id=0xaa08, seq=0/0, ttl=51 (request in 132)"
"142","13.659249","66.42.104.150","192.168.5.143","TCP","1454","443  >  54905 [ACK] Seq=11105 Ack=260 Win=39 Len=1388 TSval=3180046124 TSecr=1755910418 [TCP PDU reassembled in 144]"
"143","13.659327","192.168.5.143","66.42.104.150","TCP","66","54905  >  443 [ACK] Seq=260 Ack=12493 Win=2569 Len=0 TSval=1755910611 TSecr=3180046124"
"144","13.673723","66.42.104.150","192.168.5.143","TLSv1.2","994","Application Data"
"145","13.673788","192.168.5.143","66.42.104.150","TCP","66","54905  >  443 [ACK] Seq=260 Ack=13421 Win=2576 Len=0 TSval=1755910626 TSecr=3180046144"
"146","13.712609","66.42.104.150","192.168.5.143","TCP","66","[TCP ACKed unseen segment] 443  >  56230 [ACK] Seq=1 Ack=2 Win=42 Len=0 TSval=3180046181 TSecr=2874376462"
"147","14.031500","192.168.5.143","66.42.104.150","TCP","54","56825  >  443 [ACK] Seq=1 Ack=1 Win=2048 Len=0"
"148","14.212688","66.42.104.150","192.168.5.143","TCP","66","[TCP ACKed unseen segment] 443  >  56825 [ACK] Seq=1 Ack=2 Win=42 Len=0 TSval=3180046695 TSecr=137618674"
"149","14.535706","192.168.5.143","66.42.104.150","TCP","54","56630  >  443 [ACK] Seq=1 Ack=1 Win=2048 Len=0"
"150","14.552514","192.168.5.143","1.1.1.1","ICMP","58","Echo (ping) request  id=0xaa08, seq=0/0, ttl=64 (reply in 154)"
"151","14.617723","192.168.5.143","66.42.104.150","TLSv1.2","119","[TCP Previous segment not captured] , Application Data"
"152","14.618276","192.168.5.143","66.42.104.150","TLSv1.2","90","Application Data"
"153","14.621101","192.168.5.143","66.42.104.150","TCP","78","56916  >  443 [SYN] Seq=0 Win=65535 Len=0 MSS=1460 WS=64 TSval=3051901683 TSecr=0 SACK_PERM"
"154","14.643480","1.1.1.1","192.168.5.143","ICMP","58","Echo (ping) reply    id=0xaa08, seq=0/0, ttl=51 (request in 150)"
"155","14.717829","66.42.104.150","192.168.5.143","TCP","66","[TCP ACKed unseen segment] 443  >  56630 [ACK] Seq=1 Ack=2 Win=39 Len=0 TSval=3180047197 TSecr=4202423652"
"156","14.797487","66.42.104.150","192.168.5.143","TCP","66","443  >  56894 [ACK] Seq=1 Ack=55 Win=48 Len=0 TSval=3180047273 TSecr=2616453662"
"157","14.797488","66.42.104.150","192.168.5.143","TCP","66","443  >  56894 [ACK] Seq=1 Ack=79 Win=48 Len=0 TSval=3180047273 TSecr=2616453662"
"158","14.817164","192.168.6.1","255.255.255.255","UDP","336","52080  >  5001 Len=294"
"159","14.826272","66.42.104.150","192.168.5.143","TCP","74","443  >  56916 [SYN, ACK] Seq=0 Ack=1 Win=43440 Len=0 MSS=1400 SACK_PERM TSval=3180047277 TSecr=3051901683 WS=1024"
"160","14.826432","192.168.5.143","66.42.104.150","TCP","66","56916  >  443 [ACK] Seq=1 Ack=1 Win=131904 Len=0 TSval=3051901888 TSecr=3180047277"
"161","14.828170","192.168.5.143","66.42.104.150","TLSv1.3","664","Client Hello (SNI=www.amazon.com)"
"162","15.009486","66.42.104.150","192.168.5.143","TLSv1.2","90","Application Data"
"163","15.009488","66.42.104.150","192.168.5.143","TCP","66","443  >  56894 [FIN, ACK] Seq=25 Ack=79 Win=48 Len=0 TSval=3180047481 TSecr=2616453662"
"164","15.009607","192.168.5.143","66.42.104.150","TCP","66","56894  >  443 [ACK] Seq=79 Ack=25 Win=2048 Len=0 TSval=2616454054 TSecr=3180047481"
"165","15.009680","192.168.5.143","66.42.104.150","TCP","66","56894  >  443 [ACK] Seq=79 Ack=26 Win=2048 Len=0 TSval=2616454054 TSecr=3180047481"
"166","15.009963","192.168.5.143","66.42.104.150","TCP","66","56894  >  443 [FIN, ACK] Seq=79 Ack=26 Win=2048 Len=0 TSval=2616454054 TSecr=3180047481"
"167","15.020249","66.42.104.150","192.168.5.143","TCP","66","443  >  56916 [ACK] Seq=1 Ack=599 Win=43008 Len=0 TSval=3180047485 TSecr=3051901890"
"168","15.020251","66.42.104.150","192.168.5.143","TLSv1.3","1454","Server Hello, Change Cipher Spec, Application Data"
"169","15.020252","66.42.104.150","192.168.5.143","TCP","1454","443  >  56916 [PSH, ACK] Seq=1389 Ack=599 Win=43008 Len=1388 TSval=3180047489 TSecr=3051901890 [TCP PDU reassembled in 171]"
"170","15.020253","66.42.104.150","192.168.5.143","TCP","1454","443  >  56916 [ACK] Seq=2777 Ack=599 Win=43008 Len=1388 TSval=3180047489 TSecr=3051901890 [TCP PDU reassembled in 171]"
"171","15.020254","66.42.104.150","192.168.5.143","TLSv1.3","1231","Application Data, Application Data, Application Data"
"172","15.020394","192.168.5.143","66.42.104.150","TCP","66","56916  >  443 [ACK] Seq=599 Ack=5330 Win=126592 Len=0 TSval=3051902082 TSecr=3180047489"
"173","15.020913","192.168.5.143","66.42.104.150","TCP","66","[TCP Window Update] 56916  >  443 [ACK] Seq=599 Ack=5330 Win=131072 Len=0 TSval=3051902082 TSecr=3180047489"
"174","15.021426","192.168.5.143","66.42.104.150","TLSv1.3","130","Change Cipher Spec, Application Data"
"175","15.021607","192.168.5.143","66.42.104.150","TLSv1.3","1274","Application Data"
"176","15.021651","192.168.5.143","66.42.104.150","TLSv1.3","135","Application Data"
"177","15.171462","66.42.104.150","192.168.5.143","TCP","445","6300  >  54798 [PSH, ACK] Seq=4143 Ack=1 Win=42 Len=379 TSval=3180047651 TSecr=1568274098"
"178","15.171702","192.168.5.143","66.42.104.150","TCP","66","54798  >  6300 [ACK] Seq=1 Ack=4522 Win=2048 Len=0 TSval=1568276103 TSecr=3180047651"
"179","15.186152","66.42.104.150","192.168.5.143","TCP","66","443  >  56894 [ACK] Seq=26 Ack=80 Win=48 Len=0 TSval=3180047667 TSecr=2616454054"
"180","15.216655","66.42.104.150","192.168.5.143","TCP","78","443  >  56916 [ACK] Seq=5330 Ack=663 Win=43008 Len=0 TSval=3180047679 TSecr=3051902083 SLE=1871 SRE=1940"
"181","15.216656","66.42.104.150","192.168.5.143","TCP","66","443  >  56916 [ACK] Seq=5330 Ack=1940 Win=41984 Len=0 TSval=3180047679 TSecr=3051902083"
"182","15.216657","66.42.104.150","192.168.5.143","TLSv1.3","245","Application Data"
"183","15.216658","66.42.104.150","192.168.5.143","TLSv1.3","128","Application Data"
"184","15.216785","192.168.5.143","66.42.104.150","TCP","1274","[TCP Spurious Retransmission] 56916  >  443 [ACK] Seq=663 Ack=5330 Win=131072 Len=1208 TSval=3051902279 TSecr=3180047679"
"185","15.216881","192.168.5.143","66.42.104.150","TCP","66","56916  >  443 [ACK] Seq=1940 Ack=5571 Win=130880 Len=0 TSval=3051902279 TSecr=3180047679"
"186","15.419113","66.42.104.150","192.168.5.143","TCP","78","[TCP Dup ACK 181#1] 443  >  56916 [ACK] Seq=5571 Ack=1940 Win=41984 Len=0 TSval=3180047874 TSecr=3051902279 SLE=663 SRE=1871"
"187","15.551784","192.168.5.143","1.1.1.1","ICMP","58","Echo (ping) request  id=0xaa08, seq=0/0, ttl=64 (reply in 195)"
"188","15.578391","66.42.104.150","192.168.5.143","TLSv1.3","1274","Application Data"
"189","15.578393","66.42.104.150","192.168.5.143","TLSv1.3","1072","[TCP Previous segment not captured] , Continuation Data"
"190","15.578394","66.42.104.150","192.168.5.143","TLSv1.3","651","Application Data"
"191","15.578396","66.42.104.150","192.168.5.143","TLSv1.3","1139","Application Data"
"192","15.578550","192.168.5.143","66.42.104.150","TCP","66","56916  >  443 [ACK] Seq=1940 Ack=6779 Win=129920 Len=0 TSval=3051902640 TSecr=3180048046"
"193","15.578615","192.168.5.143","66.42.104.150","TCP","78","[TCP Dup ACK 192#1] 56916  >  443 [ACK] Seq=1940 Ack=6779 Win=129920 Len=0 TSval=3051902640 TSecr=3180048046 SLE=8167 SRE=10831"
"194","15.634023","192.168.5.57","224.0.0.251","MDNS","304","Standard query response 0x0000 PTR \345\256\242\345\216\205\347\232\204\345\260\217\347\261\263\347\224\265\350\247†._airkan._tcp.local SRV, cache flush 0 0 6088 milink521230473.local TXT, cache flush"
"195","15.654150","1.1.1.1","192.168.5.143","ICMP","58","Echo (ping) reply    id=0xaa08, seq=0/0, ttl=51 (request in 187)"
"196","15.815617","66.42.104.150","192.168.5.143","TCP","1454","[TCP Retransmission] 443  >  56916 [ACK] Seq=6779 Ack=1940 Win=41984 Len=1388 TSval=3180048285 TSecr=3051902640"
"197","15.815743","192.168.5.143","66.42.104.150","TCP","66","56916  >  443 [ACK] Seq=1940 Ack=10831 Win=127040 Len=0 TSval=3051902878 TSecr=3180048285"
"198","15.815961","192.168.5.143","66.42.104.150","TCP","66","[TCP Window Update] 56916  >  443 [ACK] Seq=1940 Ack=10831 Win=131072 Len=0 TSval=3051902878 TSecr=3180048285"
"199","15.833340","192.168.5.143","66.42.104.150","TLSv1.3","1294","Application Data"
"200","16.018311","66.42.104.150","192.168.5.143","TCP","66","443  >  56916 [ACK] Seq=10831 Ack=3168 Win=40960 Len=0 TSval=3180048491 TSecr=3051902895"
"201","16.171535","66.42.104.150","192.168.5.143","TCP","319","6300  >  54798 [PSH, ACK] Seq=4522 Ack=1 Win=42 Len=253 TSval=3180048654 TSecr=1568276103"
"202","16.171728","192.168.5.143","66.42.104.150","TCP","66","54798  >  6300 [ACK] Seq=1 Ack=4775 Win=2048 Len=0 TSval=1568277103 TSecr=3180048654"
"203","16.179228","66.42.104.150","192.168.5.143","TCP","351","6300  >  54798 [PSH, ACK] Seq=4775 Ack=1 Win=42 Len=285 TSval=3180048662 TSecr=1568276103"
"204","16.179364","192.168.5.143","66.42.104.150","TCP","66","54798  >  6300 [ACK] Seq=1 Ack=5060 Win=2048 Len=0 TSval=1568277111 TSecr=3180048662"
"205","16.212267","66.42.104.150","192.168.5.143","TLSv1.3","1061","Application Data"
"206","16.212340","192.168.5.143","66.42.104.150","TCP","66","56916  >  443 [ACK] Seq=3168 Ack=11826 Win=130112 Len=0 TSval=3051903274 TSecr=3180048674"
"207","16.213682","192.168.5.143","66.42.104.150","TLSv1.3","1217","Application Data"
"208","16.253536","192.168.5.57","192.168.7.255","MDNS","1365","Standard query response 0x0000 PTR, cache flush MiTV4-ANSM0-5ea2d814c7edaa25.local TXT, cache flush PTR _raop._tcp.local PTR 5e572dad810b@\345\256\242\345\216\205\347\232\204\345\260\217\347\261\263\347\224\265\350\247†._raop._tcp.local TXT, cache flush PTR _airplay._tcp.local PTR \345\256\242\345\216\205\347\232\204\345\260\217\347\261\263\347\224\265\350\247†._airplay._tcp.local TXT, cache flush PTR _leboremote._tcp.local PTR \345\256\242\345\216\205\347\232\204\345\260\217\347\261\263\347\224\265\350\247†._leboremote._tcp.local A, cache flush 192.168.5.57 SRV, cache flush 0 0 52266 MiTV4-ANSM0-5ea2d814c7edaa25.local SRV, cache flush 0 0 52266 MiTV4-ANSM0-5ea2d814c7edaa25.local SRV, cache flush 0 0 52266 MiTV4-ANSM0-5ea2d814c7edaa25.local NSEC, cache flush 57.5.168.192.in-addr.arpa NSEC, cache flush 5e572dad810b@\345\256\242\345\216\205\347\232\204\345\260\217\347\261\263\347\224\265\350\247†._raop._tcp.local NSEC, cache flush \345\256\242\345\216\205\347\232\204\345\260\217\347\261\263\347\224\265\350\247†._airplay._tcp.local NSEC, cache flush \345\256\242\345\216\205\347\232\204\345\260\217\347\261\263\347\224\265\350\247†._leboremote._tcp.local NSEC, cache flush MiTV4-ANSM0-5ea2d814c7edaa25.local"
"209","16.255725","192.168.5.57","224.0.0.251","MDNS","1365","Standard query response 0x0000 PTR, cache flush MiTV4-ANSM0-5ea2d814c7edaa25.local TXT, cache flush PTR _raop._tcp.local PTR 5e572dad810b@\345\256\242\345\216\205\347\232\204\345\260\217\347\261\263\347\224\265\350\247†._raop._tcp.local TXT, cache flush PTR _airplay._tcp.local PTR \345\256\242\345\216\205\347\232\204\345\260\217\347\261\263\347\224\265\350\247†._airplay._tcp.local TXT, cache flush PTR _leboremote._tcp.local PTR \345\256\242\345\216\205\347\232\204\345\260\217\347\261\263\347\224\265\350\247†._leboremote._tcp.local A, cache flush 192.168.5.57 SRV, cache flush 0 0 52266 MiTV4-ANSM0-5ea2d814c7edaa25.local SRV, cache flush 0 0 52266 MiTV4-ANSM0-5ea2d814c7edaa25.local SRV, cache flush 0 0 52266 MiTV4-ANSM0-5ea2d814c7edaa25.local NSEC, cache flush 57.5.168.192.in-addr.arpa NSEC, cache flush 5e572dad810b@\345\256\242\345\216\205\347\232\204\345\260\217\347\261\263\347\224\265\350\247†._raop._tcp.local NSEC, cache flush \345\256\242\345\216\205\347\232\204\345\260\217\347\261\263\347\224\265\350\247†._airplay._tcp.local NSEC, cache flush \345\256\242\345\216\205\347\232\204\345\260\217\347\261\263\347\224\265\350\247†._leboremote._tcp.local NSEC, cache flush MiTV4-ANSM0-5ea2d814c7edaa25.local"
